{
  "reply": "Borrador actualizado. Revisa productos, cantidades y unidades antes de comparar.",
  "status": "complete",
  "draft_items": [
    {
      "client_item_id": "00000000-0000-4000-8000-000000000001",
      "name": "leche",
      "quantity": 2,
      "unit": "L",
      "notes": null
    },
    {
      "client_item_id": "00000000-0000-4000-8000-000000000002",
      "name": "huevos",
      "quantity": 12,
      "unit": "piece",
      "notes": null
    },
    {
      "client_item_id": "00000000-0000-4000-8000-000000000003",
      "name": "arroz",
      "quantity": 1,
      "unit": "kg",
      "notes": null
    }
  ],
  "plan": null,
  "errors": []
}
